{
  "fields": {
    "income": "total_income",
    "expenses": "total_expenses",
    "market_value": "market_value",
    "vacancy_rate": "vacancy_rate"
  },
  "calculations": {
    "noi": {
      "description": "Net Operating Income = Total Income − Total Expenses",
      "method": "subtract",
      "operands": ["income", "expenses"]
    },
    "cap_rate": {
      "description": "Capitalization Rate = NOI ÷ Market Value",
      "method": "divide",
      "operands": ["noi", "market_value"]
    },
    "expense_ratio": {
      "description": "Expense Ratio = Total Expenses ÷ Total Income",
      "method": "divide",
      "operands": ["expenses", "income"]
    },
    "vacancy_adjustment": {
      "description": "Vacancy Adjustment = Income × (1 − Vacancy Rate)",
      "method": "multiply_with_complement",
      "operands": ["income", "vacancy_rate"]
    }
  },
  "expense_ratio_thresholds": {
    "low_threshold": 0.20,
    "high_threshold": 0.50
  },
  "notes": {
    "income": "Use the normalized 'total_income' field from ingestion.",
    "expenses": "Use the normalized 'total_expenses' field from ingestion.",
    "market_value": "Use the normalized 'market_value' field from ingestion (e.g., assessed value or appraised market value).",
    "vacancy_rate": "Expressed as a decimal (e.g., 0.10 for 10%)."
  }
}
